{
  "$schema": "ihris-data-list/v1",
  "id": "ihris-manage/data-list/classification",
  "form": "classification",
  "release": "4.3.3",
  "source": {
    "releaseFile": "src/i2ce/catalogue/nodes/release--i2ce--4.3.3.json",
    "releaseFileMd5": "398b1808ba0f4528a8c204ad7eea090a"
  },
  "counts": {
    "sample": 6
  },
  "records": [
    {
      "id": "1",
      "fields": {
        "name": "Medical Doctor",
        "description": "Medical doctors",
        "code": "222"
      },
      "lastModified": "2009-06-23 10:00:49",
      "definedIn": "ihris-manage/module/SampleData-classification",
      "provenance": "sample"
    },
    {
      "id": "2",
      "fields": {
        "name": "Nurse",
        "description": "Nursing and midwifery professionals",
        "code": "223"
      },
      "lastModified": "2009-06-23 10:00:49",
      "definedIn": "ihris-manage/module/SampleData-classification",
      "provenance": "sample"
    },
    {
      "id": "3",
      "fields": {
        "name": "Allied Health Professional",
        "description": "Modern health associate professionals (except nursing)",
        "code": "322"
      },
      "lastModified": "2009-06-23 10:00:49",
      "definedIn": "ihris-manage/module/SampleData-classification",
      "provenance": "sample"
    },
    {
      "id": "4",
      "fields": {
        "name": "Non-Health Professional",
        "description": "Professionals, not health",
        "code": "241"
      },
      "lastModified": "2009-06-23 10:00:49",
      "definedIn": "ihris-manage/module/SampleData-classification",
      "provenance": "sample"
    },
    {
      "id": "5",
      "fields": {
        "name": "Non-Health Support Staff",
        "description": "Support staff, not health-related",
        "code": "411"
      },
      "lastModified": "2009-06-23 10:00:49",
      "definedIn": "ihris-manage/module/SampleData-classification",
      "provenance": "sample"
    },
    {
      "id": "6",
      "fields": {
        "name": "Pharmacist",
        "description": "Dispenses drugs.",
        "code": ""
      },
      "lastModified": "2009-06-23 10:00:50",
      "definedIn": "ihris-manage/module/SampleData-classification",
      "provenance": "sample"
    }
  ]
}
