{
  "$schema": "ihris-data-list/v1",
  "id": "ihris-common/data-list/edu_type",
  "form": "edu_type",
  "release": "4.3.3",
  "source": {
    "releaseFile": "src/i2ce/catalogue/nodes/release--i2ce--4.3.3.json",
    "releaseFileMd5": "398b1808ba0f4528a8c204ad7eea090a"
  },
  "counts": {
    "sample": 5
  },
  "records": [
    {
      "id": "1",
      "fields": {
        "name": "Degree/Certification"
      },
      "lastModified": "2009-06-23 09:50:54",
      "definedIn": "ihris-common/module/SampleData-edu_type",
      "provenance": "sample"
    },
    {
      "id": "2",
      "fields": {
        "name": "Continuing Education"
      },
      "lastModified": "2009-06-23 09:50:54",
      "definedIn": "ihris-common/module/SampleData-edu_type",
      "provenance": "sample"
    },
    {
      "id": "3",
      "fields": {
        "name": "Informal"
      },
      "lastModified": "2009-06-23 09:50:54",
      "definedIn": "ihris-common/module/SampleData-edu_type",
      "provenance": "sample"
    },
    {
      "id": "4",
      "fields": {
        "name": "Other"
      },
      "lastModified": "2009-06-23 09:50:55",
      "definedIn": "ihris-common/module/SampleData-edu_type",
      "provenance": "sample"
    },
    {
      "id": "5",
      "fields": {
        "name": "High School"
      },
      "lastModified": "2009-06-23 09:50:55",
      "definedIn": "ihris-common/module/SampleData-edu_type",
      "provenance": "sample"
    }
  ]
}
