{
  "$schema": "ihris-data-list/v1",
  "id": "ihris-common/data-list/competency_evaluation",
  "form": "competency_evaluation",
  "release": "4.3.3",
  "source": {
    "releaseFile": "src/i2ce/catalogue/nodes/release--i2ce--4.3.3.json",
    "releaseFileMd5": "398b1808ba0f4528a8c204ad7eea090a"
  },
  "counts": {
    "default": 3
  },
  "records": [
    {
      "id": "not_evaluated",
      "fields": {
        "name": "Not Evaluated"
      },
      "lastModified": "2009-05-20 12:34:56",
      "definedIn": "ihris-common/module/person-simple-competency",
      "provenance": "default"
    },
    {
      "id": "competent",
      "fields": {
        "name": "Competent"
      },
      "lastModified": "2009-05-20 12:34:56",
      "definedIn": "ihris-common/module/person-simple-competency",
      "provenance": "default"
    },
    {
      "id": "not_competent",
      "fields": {
        "name": "Not Competent"
      },
      "lastModified": "2009-05-20 12:34:56",
      "definedIn": "ihris-common/module/person-simple-competency",
      "provenance": "default"
    }
  ]
}
