{
  "$schema": "ihris-data-list/v1",
  "id": "ihris-qualify/data-list/role",
  "form": "role",
  "release": "4.3.3",
  "source": {
    "releaseFile": "src/i2ce/catalogue/nodes/release--i2ce--4.3.3.json",
    "releaseFileMd5": "398b1808ba0f4528a8c204ad7eea090a"
  },
  "counts": {
    "default": 5
  },
  "records": [
    {
      "id": "manager",
      "fields": {
        "name": "Data Operations Manager",
        "trickle_up": "admin",
        "assignable": "1"
      },
      "lastModified": "2009-08-03 00:00:00",
      "definedIn": "ihris-qualify/module/ihris-qualify",
      "provenance": "default"
    },
    {
      "id": "registration",
      "fields": {
        "name": "Registration Supervisor",
        "trickle_up": "admin,manager",
        "assignable": "1"
      },
      "lastModified": "2009-08-03 00:00:00",
      "definedIn": "ihris-qualify/module/ihris-qualify",
      "provenance": "default"
    },
    {
      "id": "records",
      "fields": {
        "name": "Records Officer",
        "trickle_up": "admin,manager,registration",
        "assignable": "1"
      },
      "lastModified": "2009-08-03 00:00:00",
      "definedIn": "ihris-qualify/module/ihris-qualify",
      "provenance": "default"
    },
    {
      "id": "decision_maker",
      "fields": {
        "name": "Decision Maker",
        "trickle_up": "admin",
        "assignable": "1"
      },
      "lastModified": "2009-08-03 00:00:00",
      "definedIn": "ihris-qualify/module/ihris-qualify",
      "provenance": "default"
    },
    {
      "id": "professionals",
      "fields": {
        "name": "Professionals",
        "trickle_up": "admin",
        "assignable": "1"
      },
      "lastModified": "2013-01-05 1:23:45",
      "definedIn": "ihris-qualify/module/QualifySelfService",
      "provenance": "default"
    }
  ]
}
